{
  "video_id": "5GECTF50CFQ",
  "title": "„Äê#Ê≠åÊû†„Äë #ÂàùË¶ãÊßòÂ§ßÊ≠ìËøé  3400‰∫∫„Åæ„Åß„ÅÇ„Å®„Å°„Çá„Å£„Å®ÔºÅÔºÅüéã‚ú®„Äê#vsinger / ‰∏ÉÁØ†„Åï„Çà„Äë",
  "start_datetime": "2023-06-09T15:40:41Z",
  "thumbnail_url": "https://i.ytimg.com/vi/5GECTF50CFQ/maxresdefault.jpg",
  "timestamps": [
    {
      "time": 286,
      "original_time": "0:04:46",
      "song_id": "3oZmgEZzHTt",
      "comment_source": "comment",
      "comment_date": "2023-06-09T15:37:43Z"
    },
    {
      "time": 749,
      "original_time": "0:12:29",
      "song_id": "WwQYVhX-4_e",
      "comment_source": "comment",
      "comment_date": "2023-06-09T15:37:43Z"
    },
    {
      "time": 1275,
      "original_time": "0:21:15",
      "song_id": "qOjdqpIQ2rW",
      "comment_source": "comment",
      "comment_date": "2023-06-09T15:37:43Z"
    },
    {
      "time": 1609,
      "original_time": "0:26:49",
      "song_id": "AtJ282zCLFz",
      "comment_source": "comment",
      "comment_date": "2023-06-09T15:37:43Z"
    },
    {
      "time": 1891,
      "original_time": "0:31:31",
      "song_id": "yv_68H0Pcuf",
      "comment_source": "comment",
      "comment_date": "2023-06-09T15:37:43Z"
    },
    {
      "time": 2226,
      "original_time": "0:37:06",
      "song_id": "BoNXJ6qjbu1",
      "comment_source": "comment",
      "comment_date": "2023-06-09T15:37:43Z"
    },
    {
      "time": 2666,
      "original_time": "0:44:26",
      "song_id": "VjB6zAOUZJO",
      "comment_source": "comment",
      "comment_date": "2023-06-09T15:37:43Z"
    },
    {
      "time": 2932,
      "original_time": "0:48:52",
      "song_id": "Xj65QLxjoiZ",
      "comment_source": "comment",
      "comment_date": "2023-06-09T15:37:43Z"
    },
    {
      "time": 3348,
      "original_time": "0:55:48",
      "song_id": "we3p6_LDauG",
      "comment_source": "comment",
      "comment_date": "2023-06-09T15:37:43Z"
    },
    {
      "time": 3730,
      "original_time": "1:02:10",
      "song_id": "iC6Jn9ban0a",
      "comment_source": "comment",
      "comment_date": "2023-06-09T15:37:43Z"
    },
    {
      "time": 4031,
      "original_time": "1:07:11",
      "song_id": "0XucQqa0QtL",
      "comment_source": "comment",
      "comment_date": "2023-06-09T15:37:43Z"
    },
    {
      "time": 4405,
      "original_time": "1:13:25",
      "song_id": "OO_QHG6uVWv",
      "comment_source": "comment",
      "comment_date": "2023-06-09T15:37:43Z"
    },
    {
      "time": 4942,
      "original_time": "1:22:22",
      "song_id": "-NWCcSd6NMC",
      "comment_source": "comment",
      "comment_date": "2023-06-09T15:37:43Z"
    },
    {
      "time": 5193,
      "original_time": "1:26:33",
      "song_id": "Azk9Cphzobi",
      "comment_source": "comment",
      "comment_date": "2023-06-09T15:37:43Z"
    },
    {
      "time": 5788,
      "original_time": "1:36:28",
      "song_id": "_4Sfy2Jxx7t",
      "comment_source": "comment",
      "comment_date": "2023-06-09T15:37:43Z"
    },
    {
      "time": 5984,
      "original_time": "1:39:44",
      "song_id": "Y0Pcdov_W4m",
      "comment_source": "comment",
      "comment_date": "2023-06-09T15:37:43Z"
    },
    {
      "time": 6296,
      "original_time": "1:44:56",
      "song_id": "fjySeyd-jvl",
      "comment_source": "comment",
      "comment_date": "2023-06-09T15:37:43Z"
    },
    {
      "time": 6855,
      "original_time": "1:54:15",
      "song_id": "ZkQ1Uc7cXre",
      "comment_source": "comment",
      "comment_date": "2023-06-09T15:37:43Z"
    },
    {
      "time": 7541,
      "original_time": "2:05:41",
      "song_id": "sYWYpRw-OiJ",
      "comment_source": "comment",
      "comment_date": "2023-06-09T15:37:43Z"
    }
  ]
}