{
  "video_id": "7paV2iSQpWE",
  "title": "„Äê#Ê≠åÊû†„ÄëÈÇ¶Ê•Ω„É≠„ÉÉ„ÇØÂ§ßÂ•Ω„ÅçVtuber„ÅåÊ≠å„ÅÜ‚ÄºÔ∏è„Ç¢„Ç∏„Ç´„É≥Ê≠åÊû†Á∏õ„Çäüé∏„ÄêÔºÉ‰∏ÉÁØ†„Åï„Çà /ÔºÉVtuber „Äë #„É≠„Ç≠„Éé„É≥ #„É≠„ÉÉ„Ç≠„É≥",
  "start_datetime": "2025-11-12T03:34:18Z",
  "thumbnail_url": "https://i.ytimg.com/vi/7paV2iSQpWE/maxresdefault.jpg",
  "timestamps": [
    {
      "time": 505,
      "original_time": "0:08:25",
      "song_id": "IYQgAeUn-V9",
      "comment_source": "comment",
      "comment_date": "2025-11-11T15:11:56Z"
    },
    {
      "time": 1177,
      "original_time": "0:19:37",
      "song_id": "C9rgfjtISu1",
      "comment_source": "comment",
      "comment_date": "2025-11-11T15:11:56Z"
    },
    {
      "time": 1379,
      "original_time": "0:22:59",
      "song_id": "ME3_R1vTPql",
      "comment_source": "comment",
      "comment_date": "2025-11-11T15:11:56Z"
    },
    {
      "time": 2022,
      "original_time": "0:33:42",
      "song_id": "0ynP2-tmTJU",
      "comment_source": "comment",
      "comment_date": "2025-11-11T15:11:56Z"
    },
    {
      "time": 2347,
      "original_time": "0:39:07",
      "song_id": "uI-qNN2McLk",
      "comment_source": "comment",
      "comment_date": "2025-11-11T15:11:56Z"
    },
    {
      "time": 2702,
      "original_time": "0:45:02",
      "song_id": "VbYu2YGhytU",
      "comment_source": "comment",
      "comment_date": "2025-11-11T15:11:56Z"
    },
    {
      "time": 2966,
      "original_time": "0:49:26",
      "song_id": "llTcSFBe3Tj",
      "comment_source": "comment",
      "comment_date": "2025-11-11T15:11:56Z"
    },
    {
      "time": 3584,
      "original_time": "0:59:44",
      "song_id": "URLAtNV6j1y",
      "comment_source": "comment",
      "comment_date": "2025-11-11T15:11:56Z"
    },
    {
      "time": 3840,
      "original_time": "1:04:00",
      "song_id": "LSt3EX1tP-D",
      "comment_source": "comment",
      "comment_date": "2025-11-11T15:11:56Z"
    },
    {
      "time": 4121,
      "original_time": "1:08:41",
      "song_id": "6NL50HvyNKI",
      "comment_source": "comment",
      "comment_date": "2025-11-11T15:11:56Z"
    }
  ]
}