{
  "video_id": "IrkxAECj6Eo",
  "title": "【#歌枠 】どちらかクリアで耐久達成✨オールジャンル耐久歌枠【＃七篠さよ /＃Vtuber 】#初見さん歓迎",
  "start_datetime": "2025-05-07T13:20:01Z",
  "thumbnail_url": "https://i.ytimg.com/vi/IrkxAECj6Eo/maxresdefault.jpg",
  "timestamps": [
    {
      "time": 903,
      "original_time": "0:15:03",
      "song_id": "eBs8qaH1IAm",
      "comment_source": "comment",
      "comment_date": "2025-05-07T13:11:56Z"
    },
    {
      "time": 1269,
      "original_time": "0:21:09",
      "song_id": "cZfFVVFiqgP",
      "comment_source": "comment",
      "comment_date": "2025-05-07T13:11:56Z"
    },
    {
      "time": 1500,
      "original_time": "0:25:00",
      "song_id": "P_-DhpgoHAC",
      "comment_source": "comment",
      "comment_date": "2025-05-07T13:11:56Z"
    },
    {
      "time": 1917,
      "original_time": "0:31:57",
      "song_id": "0c5WvPb9Jsu",
      "comment_source": "comment",
      "comment_date": "2025-05-07T13:11:56Z"
    },
    {
      "time": 2589,
      "original_time": "0:43:09",
      "song_id": "IqB5Iia8tPi",
      "comment_source": "comment",
      "comment_date": "2025-05-07T13:11:56Z"
    },
    {
      "time": 2882,
      "original_time": "0:48:02",
      "song_id": "KylJgDyrrc8",
      "comment_source": "comment",
      "comment_date": "2025-05-07T13:11:56Z"
    },
    {
      "time": 3282,
      "original_time": "0:54:42",
      "song_id": "Ryl7jwi_8Jo",
      "comment_source": "comment",
      "comment_date": "2025-05-07T13:11:56Z"
    },
    {
      "time": 3593,
      "original_time": "0:59:53",
      "song_id": "QU6Sk_iS6Qi",
      "comment_source": "comment",
      "comment_date": "2025-05-07T13:11:56Z"
    },
    {
      "time": 3892,
      "original_time": "1:04:52",
      "song_id": "LQIp3dhqZIx",
      "comment_source": "comment",
      "comment_date": "2025-05-07T13:11:56Z"
    },
    {
      "time": 4258,
      "original_time": "1:10:58",
      "song_id": "ADbiI5glJ1H",
      "comment_source": "comment",
      "comment_date": "2025-05-07T13:11:56Z"
    },
    {
      "time": 4673,
      "original_time": "1:17:53",
      "song_id": "8H-13WNxL4P",
      "comment_source": "comment",
      "comment_date": "2025-05-07T13:11:56Z"
    },
    {
      "time": 5032,
      "original_time": "1:23:52",
      "song_id": "9XQnf7t3kPZ",
      "comment_source": "comment",
      "comment_date": "2025-05-07T13:11:56Z"
    },
    {
      "time": 5356,
      "original_time": "1:29:16",
      "song_id": "icrumGR5Nea",
      "comment_source": "comment",
      "comment_date": "2025-05-07T13:11:56Z"
    },
    {
      "time": 6157,
      "original_time": "1:42:37",
      "song_id": "SCnzeoDJXAL",
      "comment_source": "comment",
      "comment_date": "2025-05-07T13:11:56Z"
    },
    {
      "time": 6430,
      "original_time": "1:47:10",
      "song_id": "YjFIPVQWVrZ",
      "comment_source": "comment",
      "comment_date": "2025-05-07T13:11:56Z"
    },
    {
      "time": 6614,
      "original_time": "1:50:14",
      "song_id": "2-mxR6-N-d8",
      "comment_source": "comment",
      "comment_date": "2025-05-07T13:11:56Z"
    },
    {
      "time": 6838,
      "original_time": "1:53:58",
      "song_id": "hDxV6xyX_we",
      "comment_source": "comment",
      "comment_date": "2025-05-07T13:11:56Z"
    }
  ]
}