{
  "video_id": "wYCYO3yr4NU",
  "title": "【初見さん大歓迎 】元気になれる楽曲祭り🔥高評価100目標💥【 #歌枠/ #さよに願いを",
  "start_datetime": "2026-02-13T21:39:32Z",
  "thumbnail_url": "https://i.ytimg.com/vi/wYCYO3yr4NU/maxresdefault_live.jpg",
  "timestamps": [
    {
      "time": 1129,
      "original_time": "18:49",
      "song_id": "ar18iuK_PQC",
      "comment_source": "comment",
      "comment_date": "2026-03-30T15:36:12Z"
    },
    {
      "time": 1781,
      "original_time": "29:41",
      "song_id": "sVU64wofDaL",
      "comment_source": "comment",
      "comment_date": "2026-03-30T15:36:12Z"
    },
    {
      "time": 2350,
      "original_time": "39:10",
      "song_id": "XNFpWv-jWOW",
      "comment_source": "comment",
      "comment_date": "2026-03-30T15:36:12Z"
    },
    {
      "time": 2770,
      "original_time": "46:10",
      "song_id": "RuzfYablcIN",
      "comment_source": "comment",
      "comment_date": "2026-03-30T15:36:12Z"
    },
    {
      "time": 3091,
      "original_time": "51:31",
      "song_id": "TAqGdg8qGRB",
      "comment_source": "comment",
      "comment_date": "2026-03-30T15:36:12Z"
    },
    {
      "time": 3375,
      "original_time": "56:15",
      "song_id": "xcP8IcRvvJ0",
      "comment_source": "comment",
      "comment_date": "2026-03-30T15:36:12Z"
    },
    {
      "time": 3637,
      "original_time": "1:00:37",
      "song_id": "R9ufr_Jy97N",
      "comment_source": "comment",
      "comment_date": "2026-03-30T15:36:12Z"
    },
    {
      "time": 4348,
      "original_time": "1:12:28",
      "song_id": "e7Jq2U3sigh",
      "comment_source": "comment",
      "comment_date": "2026-03-30T15:36:12Z"
    },
    {
      "time": 4675,
      "original_time": "1:17:55",
      "song_id": "uL2rb2mBPWB",
      "comment_source": "comment",
      "comment_date": "2026-03-30T15:36:12Z"
    },
    {
      "time": 4969,
      "original_time": "1:22:49",
      "song_id": "0XucQqa0QtL",
      "comment_source": "comment",
      "comment_date": "2026-03-30T15:36:12Z"
    },
    {
      "time": 5352,
      "original_time": "1:29:12",
      "song_id": "SfzApcE6x_N",
      "comment_source": "comment",
      "comment_date": "2026-03-30T15:36:12Z"
    },
    {
      "time": 5740,
      "original_time": "1:35:40",
      "song_id": "_nk80ah33ju",
      "comment_source": "comment",
      "comment_date": "2026-03-30T15:36:12Z"
    },
    {
      "time": 6019,
      "original_time": "1:40:19",
      "song_id": "ZbtzOBFvZQU",
      "comment_source": "comment",
      "comment_date": "2026-03-30T15:36:12Z"
    },
    {
      "time": 6438,
      "original_time": "1:47:18",
      "song_id": "s1UdFSJKHT4",
      "comment_source": "comment",
      "comment_date": "2026-03-30T15:36:12Z"
    },
    {
      "time": 6768,
      "original_time": "1:52:48",
      "song_id": "HWFhkXeGasJ",
      "comment_source": "comment",
      "comment_date": "2026-03-30T15:36:12Z"
    },
    {
      "time": 7003,
      "original_time": "1:56:43",
      "song_id": "NhBloLvbpL-",
      "comment_source": "comment",
      "comment_date": "2026-03-30T15:36:12Z"
    },
    {
      "time": 7413,
      "original_time": "2:03:33",
      "song_id": "_64tYIjQkEZ",
      "comment_source": "comment",
      "comment_date": "2026-03-30T15:36:12Z"
    },
    {
      "time": 8690,
      "original_time": "2:24:50",
      "song_id": "TZunBWXCRGs",
      "comment_source": "comment",
      "comment_date": "2026-03-30T15:36:12Z"
    }
  ]
}