{
  "video_id": "SHoPAHS0bYg",
  "title": "【#初見歓迎 】週の折り返しもゆるりと元気に歌うよ✨【＃七篠さよ / #vtuber 】#歌枠",
  "start_datetime": "2024-10-17T04:22:34Z",
  "thumbnail_url": "https://i.ytimg.com/vi/SHoPAHS0bYg/maxresdefault.jpg",
  "timestamps": [
    {
      "time": 545,
      "original_time": "0:09:05",
      "song_id": "2V0nVkWBqmJ",
      "comment_source": "comment",
      "comment_date": "2024-10-16T15:18:32Z"
    },
    {
      "time": 1061,
      "original_time": "0:17:41",
      "song_id": "NsCai4NkWqc",
      "comment_source": "comment",
      "comment_date": "2024-10-16T15:18:32Z"
    },
    {
      "time": 1636,
      "original_time": "0:27:16",
      "song_id": "IFp1vr2Efaq",
      "comment_source": "comment",
      "comment_date": "2024-10-16T15:18:32Z"
    },
    {
      "time": 1898,
      "original_time": "0:31:38",
      "song_id": "Azk9Cphzobi",
      "comment_source": "comment",
      "comment_date": "2024-10-16T15:18:32Z"
    },
    {
      "time": 2658,
      "original_time": "0:44:18",
      "song_id": "XhnEmNdcZu9",
      "comment_source": "comment",
      "comment_date": "2024-10-16T15:18:32Z"
    },
    {
      "time": 3526,
      "original_time": "0:58:46",
      "song_id": "blAmkMMNRBd",
      "comment_source": "comment",
      "comment_date": "2024-10-16T15:18:32Z"
    },
    {
      "time": 3765,
      "original_time": "1:02:45",
      "song_id": "bhezYAEiRGn",
      "comment_source": "comment",
      "comment_date": "2024-10-16T15:18:32Z"
    },
    {
      "time": 4496,
      "original_time": "1:14:56",
      "song_id": "GR-EVk0rtAe",
      "comment_source": "comment",
      "comment_date": "2024-10-16T15:18:32Z"
    },
    {
      "time": 5060,
      "original_time": "1:24:20",
      "song_id": "lbMIV6h8yg2",
      "comment_source": "comment",
      "comment_date": "2024-10-16T15:18:32Z"
    },
    {
      "time": 5679,
      "original_time": "1:34:39",
      "song_id": "XIgeMokQvGU",
      "comment_source": "comment",
      "comment_date": "2024-10-16T15:18:32Z"
    },
    {
      "time": 6025,
      "original_time": "1:40:25",
      "song_id": "boI6IpBH9bG",
      "comment_source": "comment",
      "comment_date": "2024-10-16T15:18:32Z"
    },
    {
      "time": 6415,
      "original_time": "1:46:55",
      "song_id": "vQTeRstgvRj",
      "comment_source": "comment",
      "comment_date": "2024-10-16T15:18:32Z"
    }
  ]
}