{
  "video_id": "2Hza7Tn_pB4",
  "title": "„ÄêÔºÉÊ≠åÊû†„Äë‰ªäÊó•„ÅØ„Åì„Å£„Åù„Çä„Åä„ÇÑ„Åô„Åø„ÇΩ„É≥„Ç∞„Çí„ÅÇ„Å™„Åü„Å´üåü„Äê#vsinger /#‰∏ÉÁØ†„Åï„Çà„Äë#„Åï„Çà„Å´È°ò„ÅÑ„Çí",
  "start_datetime": "2023-11-11T04:08:27Z",
  "thumbnail_url": "https://i.ytimg.com/vi/2Hza7Tn_pB4/maxresdefault.jpg",
  "timestamps": [
    {
      "time": 348,
      "original_time": "0:05:48",
      "song_id": "O_jskIiqCDo",
      "comment_source": "comment",
      "comment_date": "2023-11-10T15:46:51Z"
    },
    {
      "time": 684,
      "original_time": "0:11:24",
      "song_id": "0z-1TYwzdtw",
      "comment_source": "comment",
      "comment_date": "2023-11-10T15:46:51Z"
    },
    {
      "time": 1233,
      "original_time": "0:20:33",
      "song_id": "OTe93rfaaad",
      "comment_source": "comment",
      "comment_date": "2023-11-10T15:46:51Z"
    },
    {
      "time": 1638,
      "original_time": "0:27:18",
      "song_id": "eaT1gY4-J3A",
      "comment_source": "comment",
      "comment_date": "2023-11-10T15:46:51Z"
    },
    {
      "time": 1998,
      "original_time": "0:33:18",
      "song_id": "rpTdqtLXxa1",
      "comment_source": "comment",
      "comment_date": "2023-11-10T15:46:51Z"
    },
    {
      "time": 2332,
      "original_time": "0:38:52",
      "song_id": "BDTRjv3HZS7",
      "comment_source": "comment",
      "comment_date": "2023-11-10T15:46:51Z"
    },
    {
      "time": 2635,
      "original_time": "0:43:55",
      "song_id": "qpc64vZ8aOr",
      "comment_source": "comment",
      "comment_date": "2023-11-10T15:46:51Z"
    },
    {
      "time": 2936,
      "original_time": "0:48:56",
      "song_id": "vEj7Ik0G8hS",
      "comment_source": "comment",
      "comment_date": "2023-11-10T15:46:51Z"
    },
    {
      "time": 3269,
      "original_time": "0:54:29",
      "song_id": "DkpoOoOGCo3",
      "comment_source": "comment",
      "comment_date": "2023-11-10T15:46:51Z"
    },
    {
      "time": 3670,
      "original_time": "1:01:10",
      "song_id": "zIox5vKi73R",
      "comment_source": "comment",
      "comment_date": "2023-11-10T15:46:51Z"
    },
    {
      "time": 3948,
      "original_time": "1:05:48",
      "song_id": "eei4yBzOf6J",
      "comment_source": "comment",
      "comment_date": "2023-11-10T15:46:51Z"
    },
    {
      "time": 4279,
      "original_time": "1:11:19",
      "song_id": "8KSdbA1fOm7",
      "comment_source": "comment",
      "comment_date": "2023-11-10T15:46:51Z"
    },
    {
      "time": 4525,
      "original_time": "1:15:25",
      "song_id": "B_CBPSnQx9B",
      "comment_source": "comment",
      "comment_date": "2023-11-10T15:46:51Z"
    },
    {
      "time": 4810,
      "original_time": "1:20:10",
      "song_id": "PdsCXmYjPBQ",
      "comment_source": "comment",
      "comment_date": "2023-11-10T15:46:51Z"
    },
    {
      "time": 5417,
      "original_time": "1:30:17",
      "song_id": "9-fUYuHObTp",
      "comment_source": "comment",
      "comment_date": "2023-11-10T15:46:51Z"
    },
    {
      "time": 6407,
      "original_time": "1:46:47",
      "song_id": "NoQJnl9qnlM",
      "comment_source": "comment",
      "comment_date": "2023-11-10T15:46:51Z"
    }
  ]
}