{
  "video_id": "7NHiprp0bHs",
  "title": "„ÄêÔºÉÊ≠åÊû†„Äë2023Âπ¥„ÇÇ„É©„Çπ„Éà2„É∂Êúà„Å†„Å£„Å¶ÔºüÔºÅüåü„Äê#vsinger /#‰∏ÉÁØ†„Åï„Çà„Äë#„Åï„Çà„Å´È°ò„ÅÑ„Çí",
  "start_datetime": "2023-11-01T14:17:18Z",
  "thumbnail_url": "https://i.ytimg.com/vi/7NHiprp0bHs/maxresdefault.jpg",
  "timestamps": [
    {
      "time": 104,
      "original_time": "0:01:44",
      "song_id": "FBIANDcdBcE",
      "comment_source": "comment",
      "comment_date": "2023-11-01T14:13:28Z"
    },
    {
      "time": 749,
      "original_time": "0:12:29",
      "song_id": "atzqmK4wN20",
      "comment_source": "comment",
      "comment_date": "2023-11-01T14:13:28Z"
    },
    {
      "time": 1209,
      "original_time": "0:20:09",
      "song_id": "HgFjMlPgkKt",
      "comment_source": "comment",
      "comment_date": "2023-11-01T14:13:28Z"
    },
    {
      "time": 1454,
      "original_time": "0:24:14",
      "song_id": "we3p6_LDauG",
      "comment_source": "comment",
      "comment_date": "2023-11-01T14:13:28Z"
    },
    {
      "time": 1744,
      "original_time": "0:29:04",
      "song_id": "UPPhFGmXJXF",
      "comment_source": "comment",
      "comment_date": "2023-11-01T14:13:28Z"
    },
    {
      "time": 2059,
      "original_time": "0:34:19",
      "song_id": "96iU4CnGKxl",
      "comment_source": "comment",
      "comment_date": "2023-11-01T14:13:28Z"
    },
    {
      "time": 2306,
      "original_time": "0:38:26",
      "song_id": "wi12xGH-JTR",
      "comment_source": "comment",
      "comment_date": "2023-11-01T14:13:28Z"
    },
    {
      "time": 2657,
      "original_time": "0:44:17",
      "song_id": "qXhUWlpg1AB",
      "comment_source": "comment",
      "comment_date": "2023-11-01T14:13:28Z"
    },
    {
      "time": 3152,
      "original_time": "0:52:32",
      "song_id": "a-K0vSEc9dl",
      "comment_source": "comment",
      "comment_date": "2023-11-01T14:13:28Z"
    },
    {
      "time": 3458,
      "original_time": "0:57:38",
      "song_id": "8cKhBzUMoz1",
      "comment_source": "comment",
      "comment_date": "2023-11-01T14:13:28Z"
    },
    {
      "time": 3740,
      "original_time": "1:02:20",
      "song_id": "e5EwLjx5xza",
      "comment_source": "comment",
      "comment_date": "2023-11-01T14:13:28Z"
    },
    {
      "time": 4103,
      "original_time": "1:08:23",
      "song_id": "GcKdoIxkv_K",
      "comment_source": "comment",
      "comment_date": "2023-11-01T14:13:28Z"
    },
    {
      "time": 4689,
      "original_time": "1:18:09",
      "song_id": "ETgynO_HlhE",
      "comment_source": "comment",
      "comment_date": "2023-11-01T14:13:28Z"
    },
    {
      "time": 5060,
      "original_time": "1:24:20",
      "song_id": "huMGhFvwD2S",
      "comment_source": "comment",
      "comment_date": "2023-11-01T14:13:28Z"
    },
    {
      "time": 5505,
      "original_time": "1:31:45",
      "song_id": "5hqpXY2Reg8",
      "comment_source": "comment",
      "comment_date": "2023-11-01T14:13:28Z"
    },
    {
      "time": 5866,
      "original_time": "1:37:46",
      "song_id": "FICpgdk1US6",
      "comment_source": "comment",
      "comment_date": "2023-11-01T14:13:28Z"
    },
    {
      "time": 6120,
      "original_time": "1:42:00",
      "song_id": "-BlKR8ht9Yl",
      "comment_source": "comment",
      "comment_date": "2023-11-01T14:13:28Z"
    },
    {
      "time": 6723,
      "original_time": "1:52:03",
      "song_id": "1DHk03BUxrw",
      "comment_source": "comment",
      "comment_date": "2023-11-01T14:13:28Z"
    }
  ]
}