{
  "video_id": "3n8stzx53zI",
  "title": "„Äê#Ê≠åÊû†„ÄëSAKANAQUARIUM„ÅåÊúÄÈ´ò„Åô„Åé„Åü„ÅÆ„ÅßÈÇ¶„É≠„ÉÉ„ÇØ„Ç™„Çø„ÇØ„Åå„Çµ„Ç´„Éä„ÇØ„Ç∑„Éß„É≥Á∏õ„ÇäÊ≠åÊû†üêüÔ∏è‚ú®„ÄêÔºÉ‰∏ÉÁØ†„Åï„Çà /ÔºÉVtuber „Äë#ÂàùË¶ã„Åï„ÇìÊ≠ìËøé #„Çµ„Ç´„Éä„ÇØ„Ç∑„Éß„É≥",
  "start_datetime": "2025-08-29T11:08:54Z",
  "thumbnail_url": "https://i.ytimg.com/vi/3n8stzx53zI/maxresdefault.jpg",
  "timestamps": [
    {
      "time": 355,
      "original_time": "0:05:55",
      "song_id": "Ba-bnnEqp4O",
      "comment_source": "comment",
      "comment_date": "2025-08-29T12:52:16Z"
    },
    {
      "time": 599,
      "original_time": "0:09:59",
      "song_id": "j1bPaH0E6M7",
      "comment_source": "comment",
      "comment_date": "2025-08-29T12:52:16Z"
    },
    {
      "time": 852,
      "original_time": "0:14:12",
      "song_id": "gFnVB7A7xGD",
      "comment_source": "comment",
      "comment_date": "2025-08-29T12:52:16Z"
    },
    {
      "time": 1366,
      "original_time": "0:22:46",
      "song_id": "MgZ3JERb66g",
      "comment_source": "comment",
      "comment_date": "2025-08-29T12:52:16Z"
    },
    {
      "time": 1606,
      "original_time": "0:26:46",
      "song_id": "9gTJjikwxJk",
      "comment_source": "comment",
      "comment_date": "2025-08-29T12:52:16Z"
    },
    {
      "time": 3169,
      "original_time": "0:52:49",
      "song_id": "JqJo7TXRgYt",
      "comment_source": "comment",
      "comment_date": "2025-08-29T12:52:16Z"
    },
    {
      "time": 3460,
      "original_time": "0:57:40",
      "song_id": "O-LUx5HHLVZ",
      "comment_source": "comment",
      "comment_date": "2025-08-29T12:52:16Z"
    },
    {
      "time": 3693,
      "original_time": "1:01:33",
      "song_id": "5cQAz5i1RQh",
      "comment_source": "comment",
      "comment_date": "2025-08-29T12:52:16Z"
    },
    {
      "time": 3956,
      "original_time": "1:05:56",
      "song_id": "HTpdssOJYVi",
      "comment_source": "comment",
      "comment_date": "2025-08-29T12:52:16Z"
    },
    {
      "time": 4298,
      "original_time": "1:11:38",
      "song_id": "TrEbXxmOKR9",
      "comment_source": "comment",
      "comment_date": "2025-08-29T12:52:16Z"
    },
    {
      "time": 5621,
      "original_time": "1:33:41",
      "song_id": "Q6TIFxvsKws",
      "comment_source": "comment",
      "comment_date": "2025-08-29T12:52:16Z"
    },
    {
      "time": 5906,
      "original_time": "1:38:26",
      "song_id": "OW5ABHtreN8",
      "comment_source": "comment",
      "comment_date": "2025-08-29T12:52:16Z"
    },
    {
      "time": 6201,
      "original_time": "1:43:21",
      "song_id": "Bq9MHFWzWad",
      "comment_source": "comment",
      "comment_date": "2025-08-29T12:52:16Z"
    },
    {
      "time": 6444,
      "original_time": "1:47:24",
      "song_id": "hLxj8RrFspo",
      "comment_source": "comment",
      "comment_date": "2025-08-29T12:52:16Z"
    },
    {
      "time": 6654,
      "original_time": "1:50:54",
      "song_id": "YHQ5pJA1cbE",
      "comment_source": "comment",
      "comment_date": "2025-08-29T12:52:16Z"
    },
    {
      "time": 6953,
      "original_time": "1:55:53",
      "song_id": "9pK-mwyemQ1",
      "comment_source": "comment",
      "comment_date": "2025-08-29T12:52:16Z"
    },
    {
      "time": 7809,
      "original_time": "2:10:09",
      "song_id": "lHRHIAZMfqn",
      "comment_source": "comment",
      "comment_date": "2025-08-29T12:52:16Z"
    },
    {
      "time": 8118,
      "original_time": "2:15:18",
      "song_id": "oyMkz_GehvR",
      "comment_source": "comment",
      "comment_date": "2025-08-29T12:52:16Z"
    }
  ]
}