{
  "video_id": "Tl0qbbwOyZg",
  "title": "【#SessionROOTS】サーキット出演者共にお送りする一夜限りのコラボ歌枠【#七篠さよ /#おまる 】",
  "start_datetime": "2025-12-03T14:44:37Z",
  "thumbnail_url": "https://i.ytimg.com/vi/Tl0qbbwOyZg/maxresdefault.jpg",
  "timestamps": [
    {
      "time": 0,
      "original_time": "00:00:00",
      "song_id": "thC9SJuRgEY",
      "comment_source": "description"
    },
    {
      "time": 78,
      "original_time": "00:01:18",
      "song_id": "qf9PmeRlk3T",
      "comment_source": "description"
    },
    {
      "time": 167,
      "original_time": "00:02:47",
      "song_id": "5K2vdSBEwDt",
      "comment_source": "description"
    },
    {
      "time": 665,
      "original_time": "00:11:05",
      "song_id": "0oOK00zXYJr",
      "comment_source": "description"
    },
    {
      "time": 963,
      "original_time": "00:16:03",
      "song_id": "KqEwCMpW8hD",
      "comment_source": "description"
    },
    {
      "time": 1195,
      "original_time": "00:19:55",
      "song_id": "-XoFv-7fjOk",
      "comment_source": "description"
    },
    {
      "time": 1446,
      "original_time": "00:24:06",
      "song_id": "ACIMGJT3dP7",
      "comment_source": "description"
    },
    {
      "time": 1846,
      "original_time": "00:30:46",
      "song_id": "LK-0V1JEio7",
      "comment_source": "description"
    },
    {
      "time": 2209,
      "original_time": "00:36:49",
      "song_id": "QueN0ws5qVo",
      "comment_source": "description"
    },
    {
      "time": 2481,
      "original_time": "00:41:21",
      "song_id": "3RDN87xQw8A",
      "comment_source": "description"
    },
    {
      "time": 2948,
      "original_time": "00:49:08",
      "song_id": "VC1Gpqnjz7V",
      "comment_source": "description"
    },
    {
      "time": 3148,
      "original_time": "00:52:28",
      "song_id": "ArziU9NZWPL",
      "comment_source": "description"
    },
    {
      "time": 3484,
      "original_time": "00:58:04",
      "song_id": "xZBGCnCr-q3",
      "comment_source": "description"
    },
    {
      "time": 3859,
      "original_time": "01:04:19",
      "song_id": "1X3lt-K4bYo",
      "comment_source": "description"
    },
    {
      "time": 4116,
      "original_time": "01:08:36",
      "song_id": "2AMO3IXDs8I",
      "comment_source": "description"
    },
    {
      "time": 4374,
      "original_time": "01:12:54",
      "song_id": "E0qRORHBwMC",
      "comment_source": "description"
    },
    {
      "time": 4683,
      "original_time": "01:18:03",
      "song_id": "Madco2ykMN1",
      "comment_source": "description"
    },
    {
      "time": 4840,
      "original_time": "01:20:40",
      "song_id": "Jf7bKvCX3um",
      "comment_source": "description"
    },
    {
      "time": 5064,
      "original_time": "01:24:24",
      "song_id": "VNFWYiFwfiJ",
      "comment_source": "description"
    },
    {
      "time": 5429,
      "original_time": "01:30:29",
      "song_id": "dxz5QhU2A6c",
      "comment_source": "description"
    },
    {
      "time": 5696,
      "original_time": "01:34:56",
      "song_id": "zjryWqtp_Kk",
      "comment_source": "description"
    },
    {
      "time": 6015,
      "original_time": "01:40:15",
      "song_id": "9k3Bx4apa94",
      "comment_source": "description"
    },
    {
      "time": 6317,
      "original_time": "01:45:17",
      "song_id": "-zdDkMeS1Et",
      "comment_source": "description"
    },
    {
      "time": 6615,
      "original_time": "01:50:15",
      "song_id": "oCVEt65OfV5",
      "comment_source": "description"
    },
    {
      "time": 6918,
      "original_time": "01:55:18",
      "song_id": "4wXHGAaMfBy",
      "comment_source": "description"
    },
    {
      "time": 7217,
      "original_time": "02:00:17",
      "song_id": "T2tpt3FvGIx",
      "comment_source": "description"
    },
    {
      "time": 7494,
      "original_time": "02:04:54",
      "song_id": "085Q6ci4s_c",
      "comment_source": "description"
    },
    {
      "time": 7833,
      "original_time": "02:10:33",
      "song_id": "RRFishYAM8p",
      "comment_source": "description"
    },
    {
      "time": 8114,
      "original_time": "02:15:14",
      "song_id": "QCsVAm855hx",
      "comment_source": "description"
    },
    {
      "time": 8477,
      "original_time": "02:21:17",
      "song_id": "nNKPAnO09gM",
      "comment_source": "description"
    },
    {
      "time": 8823,
      "original_time": "02:27:03",
      "song_id": "KydkxiDKK1w",
      "comment_source": "description"
    },
    {
      "time": 9150,
      "original_time": "02:32:30",
      "song_id": "wO1zZEDEmS5",
      "comment_source": "description"
    },
    {
      "time": 9560,
      "original_time": "02:39:20",
      "song_id": "d8GiFGpMVnt",
      "comment_source": "description"
    },
    {
      "time": 9866,
      "original_time": "02:44:26",
      "song_id": "ddUn_7Kebnv",
      "comment_source": "description"
    },
    {
      "time": 10182,
      "original_time": "02:49:42",
      "song_id": "6X1X_XfyciQ",
      "comment_source": "description"
    },
    {
      "time": 10394,
      "original_time": "02:53:14",
      "song_id": "x9TPGYXNP5q",
      "comment_source": "description"
    },
    {
      "time": 10651,
      "original_time": "02:57:31",
      "song_id": "1-FW553nLG7",
      "comment_source": "description"
    },
    {
      "time": 10929,
      "original_time": "03:02:09",
      "song_id": "gsJheI5rbFu",
      "comment_source": "description"
    },
    {
      "time": 11294,
      "original_time": "03:08:14",
      "song_id": "zQAgSHU6TRa",
      "comment_source": "description"
    },
    {
      "time": 11589,
      "original_time": "03:13:09",
      "song_id": "UXyX7fR2DoW",
      "comment_source": "description"
    },
    {
      "time": 11887,
      "original_time": "03:18:07",
      "song_id": "MC-KXa08cnm",
      "comment_source": "description"
    },
    {
      "time": 12134,
      "original_time": "03:22:14",
      "song_id": "iA-1DdFtrMH",
      "comment_source": "description"
    },
    {
      "time": 12432,
      "original_time": "03:27:12",
      "song_id": "yX7kh86mq3C",
      "comment_source": "description"
    },
    {
      "time": 12566,
      "original_time": "03:29:26",
      "song_id": "r9AL27EkT-l",
      "comment_source": "description"
    },
    {
      "time": 12828,
      "original_time": "03:33:48",
      "song_id": "IuutUbiefIK",
      "comment_source": "description"
    },
    {
      "time": 13070,
      "original_time": "03:37:50",
      "song_id": "R4bcvfYFgWg",
      "comment_source": "description"
    },
    {
      "time": 13509,
      "original_time": "03:45:09",
      "song_id": "cbndU1cu3ib",
      "comment_source": "description"
    },
    {
      "time": 13885,
      "original_time": "03:51:25",
      "song_id": "JTeyZnc41Y4",
      "comment_source": "description"
    },
    {
      "time": 14138,
      "original_time": "03:55:38",
      "song_id": "ASZx3Zdi0f8",
      "comment_source": "description"
    },
    {
      "time": 14473,
      "original_time": "04:01:13",
      "song_id": "B8gcVDDOnHh",
      "comment_source": "description"
    },
    {
      "time": 14866,
      "original_time": "04:07:46",
      "song_id": "2JFHaMEsoee",
      "comment_source": "description"
    },
    {
      "time": 15139,
      "original_time": "04:12:19",
      "song_id": "HDicclISMxW",
      "comment_source": "description"
    },
    {
      "time": 15415,
      "original_time": "04:16:55",
      "song_id": "yDFmfxHi8uA",
      "comment_source": "description"
    },
    {
      "time": 15815,
      "original_time": "04:23:35",
      "song_id": "kAC66PVrdXj",
      "comment_source": "description"
    },
    {
      "time": 16099,
      "original_time": "04:28:19",
      "song_id": "oFDyrqgoEXd",
      "comment_source": "description"
    },
    {
      "time": 16434,
      "original_time": "04:33:54",
      "song_id": "qKfncB1LtBb",
      "comment_source": "description"
    },
    {
      "time": 16806,
      "original_time": "04:40:06",
      "song_id": "6bU0Bia5C-Z",
      "comment_source": "description"
    },
    {
      "time": 17090,
      "original_time": "04:44:50",
      "song_id": "iyscD2Z1bXQ",
      "comment_source": "description"
    },
    {
      "time": 17496,
      "original_time": "04:51:36",
      "song_id": "p5Qzks4NPdl",
      "comment_source": "description"
    },
    {
      "time": 17516,
      "original_time": "04:51:56",
      "song_id": "ZHzj7lksss0",
      "comment_source": "description"
    },
    {
      "time": 17893,
      "original_time": "04:58:13",
      "song_id": "HOgSc0VcVr0",
      "comment_source": "description"
    },
    {
      "time": 18170,
      "original_time": "05:02:50",
      "song_id": "Xt3-BIlnC-e",
      "comment_source": "description"
    },
    {
      "time": 18421,
      "original_time": "05:07:01",
      "song_id": "ZYQ3znE3F1L",
      "comment_source": "description"
    }
  ]
}