{
  "video_id": "VeEyxdoV6oc",
  "title": "„Äê#Ê≠åÊû†„Äë #ÂàùË¶ãÊßòÂ§ßÊ≠ìËøé  ÈáëÊõúÂ§ú„ÅÆ„Åå„Å£„Å§„ÇäÊ≠åÊû†üéã‚ú®„Åü„Åè„Åï„ÇìÊ≠å„ÅÜ„ÅûÔºÅ„Äê#vsinger / ‰∏ÉÁØ†„Åï„Çà„Äë",
  "start_datetime": "2023-05-26T16:45:27Z",
  "thumbnail_url": "https://i.ytimg.com/vi/VeEyxdoV6oc/maxresdefault.jpg",
  "timestamps": [
    {
      "time": 507,
      "original_time": "0:08:27",
      "song_id": "2367Yt2PWVc",
      "comment_source": "comment",
      "comment_date": "2023-05-26T16:29:36Z"
    },
    {
      "time": 971,
      "original_time": "0:16:11",
      "song_id": "J1AGIazEk2f",
      "comment_source": "comment",
      "comment_date": "2023-05-26T16:29:36Z"
    },
    {
      "time": 1785,
      "original_time": "0:29:45",
      "song_id": "fjySeyd-jvl",
      "comment_source": "comment",
      "comment_date": "2023-05-26T16:29:36Z"
    },
    {
      "time": 2377,
      "original_time": "0:39:37",
      "song_id": "KRC8OFdXlAv",
      "comment_source": "comment",
      "comment_date": "2023-05-26T16:29:36Z"
    },
    {
      "time": 2749,
      "original_time": "0:45:49",
      "song_id": "MjFTDJWIxo3",
      "comment_source": "comment",
      "comment_date": "2023-05-26T16:29:36Z"
    },
    {
      "time": 3164,
      "original_time": "0:52:44",
      "song_id": "wLVG0oNIZLX",
      "comment_source": "comment",
      "comment_date": "2023-05-26T16:29:36Z"
    },
    {
      "time": 3601,
      "original_time": "1:00:01",
      "song_id": "RLvyGXDLZie",
      "comment_source": "comment",
      "comment_date": "2023-05-26T16:29:36Z"
    },
    {
      "time": 4148,
      "original_time": "1:09:08",
      "song_id": "CHaPoX8JJ1v",
      "comment_source": "comment",
      "comment_date": "2023-05-26T16:29:36Z"
    },
    {
      "time": 4491,
      "original_time": "1:14:51",
      "song_id": "xSeuZOxnQBS",
      "comment_source": "comment",
      "comment_date": "2023-05-26T16:29:36Z"
    },
    {
      "time": 5003,
      "original_time": "1:23:23",
      "song_id": "Tftp5Y8Rww_",
      "comment_source": "comment",
      "comment_date": "2023-05-26T16:29:36Z"
    },
    {
      "time": 5435,
      "original_time": "1:30:35",
      "song_id": "qBve_jZ0m85",
      "comment_source": "comment",
      "comment_date": "2023-05-26T16:29:36Z"
    },
    {
      "time": 5693,
      "original_time": "1:34:53",
      "song_id": "McaKx6QzL_I",
      "comment_source": "comment",
      "comment_date": "2023-05-26T16:29:36Z"
    },
    {
      "time": 6083,
      "original_time": "1:41:23",
      "song_id": "3c74CJiEtKO",
      "comment_source": "comment",
      "comment_date": "2023-05-26T16:29:36Z"
    },
    {
      "time": 6497,
      "original_time": "1:48:17",
      "song_id": "eKzEXGNU1uz",
      "comment_source": "comment",
      "comment_date": "2023-05-26T16:29:36Z"
    },
    {
      "time": 6938,
      "original_time": "1:55:38",
      "song_id": "QgTBX0NpOfc",
      "comment_source": "comment",
      "comment_date": "2023-05-26T16:29:36Z"
    },
    {
      "time": 7267,
      "original_time": "2:01:07",
      "song_id": "9uSXP4hnoaJ",
      "comment_source": "comment",
      "comment_date": "2023-05-26T16:29:36Z"
    },
    {
      "time": 7713,
      "original_time": "2:08:33",
      "song_id": "FMD0rzQWtvk",
      "comment_source": "comment",
      "comment_date": "2023-05-26T16:29:36Z"
    },
    {
      "time": 8139,
      "original_time": "2:15:39",
      "song_id": "CF6G6v5S87P",
      "comment_source": "comment",
      "comment_date": "2023-05-26T16:29:36Z"
    },
    {
      "time": 8586,
      "original_time": "2:23:06",
      "song_id": "LPhRsa8vh5Q",
      "comment_source": "comment",
      "comment_date": "2023-05-26T16:29:36Z"
    },
    {
      "time": 9091,
      "original_time": "2:31:31",
      "song_id": "39aNb2G3zBw",
      "comment_source": "comment",
      "comment_date": "2023-05-26T16:29:36Z"
    },
    {
      "time": 9314,
      "original_time": "2:35:14",
      "song_id": "1Nk_Hqms11O",
      "comment_source": "comment",
      "comment_date": "2023-05-26T16:29:36Z"
    },
    {
      "time": 9821,
      "original_time": "2:43:41",
      "song_id": "l-zt7eJPnvj",
      "comment_source": "comment",
      "comment_date": "2023-05-26T16:29:36Z"
    },
    {
      "time": 10160,
      "original_time": "2:49:20",
      "song_id": "1P8sjPa2N96",
      "comment_source": "comment",
      "comment_date": "2023-05-26T16:29:36Z"
    },
    {
      "time": 10915,
      "original_time": "3:01:55",
      "song_id": "fgVM2EyVns8",
      "comment_source": "comment",
      "comment_date": "2023-05-26T16:29:36Z"
    },
    {
      "time": 11319,
      "original_time": "3:08:39",
      "song_id": "Djmy-21_ONI",
      "comment_source": "comment",
      "comment_date": "2023-05-26T16:29:36Z"
    },
    {
      "time": 11821,
      "original_time": "3:17:01",
      "song_id": "WY4kGPeBlDV",
      "comment_source": "comment",
      "comment_date": "2023-05-26T16:29:36Z"
    },
    {
      "time": 12131,
      "original_time": "3:22:11",
      "song_id": "OqIN6LsEic9",
      "comment_source": "comment",
      "comment_date": "2023-05-26T16:29:36Z"
    },
    {
      "time": 12362,
      "original_time": "3:26:02",
      "song_id": "P-_wIDlE8So",
      "comment_source": "comment",
      "comment_date": "2023-05-26T16:29:36Z"
    },
    {
      "time": 12708,
      "original_time": "3:31:48",
      "song_id": "0c5WvPb9Jsu",
      "comment_source": "comment",
      "comment_date": "2023-05-26T16:29:36Z"
    },
    {
      "time": 13046,
      "original_time": "3:37:26",
      "song_id": "qOjdqpIQ2rW",
      "comment_source": "comment",
      "comment_date": "2023-05-26T16:29:36Z"
    },
    {
      "time": 14205,
      "original_time": "3:56:45",
      "song_id": "CGrukB5dlWB",
      "comment_source": "comment",
      "comment_date": "2023-05-26T16:29:36Z"
    }
  ]
}