{
  "video_id": "DWFxcFNFoOw",
  "title": "„Äê#ÂàùË¶ã„Åï„ÇìÂ§ßÊ≠ìËøé„ÄëÈõ®„ÅÆÊó•Ê≠åÊû†„Åó„Å£„Å®„Çä„Åã„ÇâÊúÄÊñ∞Êõ≤„Åæ„Åß‚òîÔ∏èüê∏„Äê#vsinger / #‰∏ÉÁØ†„Åï„Çà„Äë#„Åï„Çà„Å´È°ò„ÅÑ„Çí #Ê≠åÊû†",
  "start_datetime": "2024-08-30T14:38:55Z",
  "thumbnail_url": "https://i.ytimg.com/vi/DWFxcFNFoOw/maxresdefault.jpg",
  "timestamps": [
    {
      "time": 95,
      "original_time": "0:01:35",
      "song_id": "PEIbDjpggvI",
      "comment_source": "comment",
      "comment_date": "2024-08-30T14:28:33Z"
    },
    {
      "time": 740,
      "original_time": "0:12:20",
      "song_id": "hJhH3q3hswn",
      "comment_source": "comment",
      "comment_date": "2024-08-30T14:28:33Z"
    },
    {
      "time": 1014,
      "original_time": "0:16:54",
      "song_id": "we3p6_LDauG",
      "comment_source": "comment",
      "comment_date": "2024-08-30T14:28:33Z"
    },
    {
      "time": 1572,
      "original_time": "0:26:12",
      "song_id": "fH9OpZgNDPZ",
      "comment_source": "comment",
      "comment_date": "2024-08-30T14:28:33Z"
    },
    {
      "time": 2153,
      "original_time": "0:35:53",
      "song_id": "boI6IpBH9bG",
      "comment_source": "comment",
      "comment_date": "2024-08-30T14:28:33Z"
    },
    {
      "time": 2400,
      "original_time": "0:40:00",
      "song_id": "UrZE79mnxCx",
      "comment_source": "comment",
      "comment_date": "2024-08-30T14:28:33Z"
    },
    {
      "time": 2690,
      "original_time": "0:44:50",
      "song_id": "llELSjIAcOP",
      "comment_source": "comment",
      "comment_date": "2024-08-30T14:28:33Z"
    },
    {
      "time": 3173,
      "original_time": "0:52:53",
      "song_id": "3yYLK11mwl7",
      "comment_source": "comment",
      "comment_date": "2024-08-30T14:28:33Z"
    },
    {
      "time": 3477,
      "original_time": "0:57:57",
      "song_id": "huMGhFvwD2S",
      "comment_source": "comment",
      "comment_date": "2024-08-30T14:28:33Z"
    },
    {
      "time": 4378,
      "original_time": "1:12:58",
      "song_id": "TQeKBbbFXEa",
      "comment_source": "comment",
      "comment_date": "2024-08-30T14:28:33Z"
    },
    {
      "time": 4717,
      "original_time": "1:18:37",
      "song_id": "8IaAT9RHUo2",
      "comment_source": "comment",
      "comment_date": "2024-08-30T14:28:33Z"
    },
    {
      "time": 4991,
      "original_time": "1:23:11",
      "song_id": "HyVy050hJ3Z",
      "comment_source": "comment",
      "comment_date": "2024-08-30T14:28:33Z"
    },
    {
      "time": 5205,
      "original_time": "1:26:45",
      "song_id": "qpc64vZ8aOr",
      "comment_source": "comment",
      "comment_date": "2024-08-30T14:28:33Z"
    },
    {
      "time": 5430,
      "original_time": "1:30:30",
      "song_id": "zIox5vKi73R",
      "comment_source": "comment",
      "comment_date": "2024-08-30T14:28:33Z"
    },
    {
      "time": 5941,
      "original_time": "1:39:01",
      "song_id": "M0IDW8nIvzN",
      "comment_source": "comment",
      "comment_date": "2024-08-30T14:28:33Z"
    },
    {
      "time": 7003,
      "original_time": "1:56:43",
      "song_id": "is4qOktbSow",
      "comment_source": "comment",
      "comment_date": "2024-08-30T14:28:33Z"
    },
    {
      "time": 7261,
      "original_time": "2:01:01",
      "song_id": "RuhdqBk-Uzk",
      "comment_source": "comment",
      "comment_date": "2024-08-30T14:28:33Z"
    },
    {
      "time": 7534,
      "original_time": "2:05:34",
      "song_id": "lbMIV6h8yg2",
      "comment_source": "comment",
      "comment_date": "2024-08-30T14:28:33Z"
    },
    {
      "time": 7997,
      "original_time": "2:13:17",
      "song_id": "u5Hm8ZqjBYL",
      "comment_source": "comment",
      "comment_date": "2024-08-30T14:28:33Z"
    },
    {
      "time": 6340,
      "original_time": "1:45:40",
      "song_id": "D8lNDShcLMR",
      "comment_source": "comment",
      "comment_date": "2024-08-30T14:28:33Z"
    }
  ]
}