{
  "video_id": "PAVYl-iy8Ug",
  "title": "„Äê#Ê≠åÊû† „Äë„Ç¢„Éã„ÇΩ„É≥Á•ûOP‰∏ªÈ°åÊ≠åÁ∏õ„Çäüí•„ÄêÔºÉ‰∏ÉÁØ†„Åï„Çà /ÔºÉVtuber „Äë#ÂàùË¶ã„Åï„ÇìÊ≠ìËøé",
  "start_datetime": "2025-05-28T14:28:03Z",
  "thumbnail_url": "https://i.ytimg.com/vi/PAVYl-iy8Ug/maxresdefault.jpg",
  "timestamps": [
    {
      "time": 95,
      "original_time": "0:01:35",
      "song_id": "IymzQxsbvVi",
      "comment_source": "comment",
      "comment_date": "2025-05-28T14:19:24Z"
    },
    {
      "time": 542,
      "original_time": "0:09:02",
      "song_id": "Vyfui_5SSQ9",
      "comment_source": "comment",
      "comment_date": "2025-05-28T14:19:24Z"
    },
    {
      "time": 1047,
      "original_time": "0:17:27",
      "song_id": "2B3tpiWXWe3",
      "comment_source": "comment",
      "comment_date": "2025-05-28T14:19:24Z"
    },
    {
      "time": 1455,
      "original_time": "0:24:15",
      "song_id": "Lhf93KvvSzD",
      "comment_source": "comment",
      "comment_date": "2025-05-28T14:19:24Z"
    },
    {
      "time": 2081,
      "original_time": "0:34:41",
      "song_id": "-shw9nJZW7u",
      "comment_source": "comment",
      "comment_date": "2025-05-28T14:19:24Z"
    },
    {
      "time": 2378,
      "original_time": "0:39:38",
      "song_id": "AVFv3MRllh7",
      "comment_source": "comment",
      "comment_date": "2025-05-28T14:19:24Z"
    },
    {
      "time": 3086,
      "original_time": "0:51:26",
      "song_id": "fO9Wj8L3QtS",
      "comment_source": "comment",
      "comment_date": "2025-05-28T14:19:24Z"
    },
    {
      "time": 3380,
      "original_time": "0:56:20",
      "song_id": "Y_XlpqzvZ8Y",
      "comment_source": "comment",
      "comment_date": "2025-05-28T14:19:24Z"
    },
    {
      "time": 3962,
      "original_time": "1:06:02",
      "song_id": "n0z9aAMI-ce",
      "comment_source": "comment",
      "comment_date": "2025-05-28T14:19:24Z"
    },
    {
      "time": 4195,
      "original_time": "1:09:55",
      "song_id": "iurvzu4jYF8",
      "comment_source": "comment",
      "comment_date": "2025-05-28T14:19:24Z"
    },
    {
      "time": 4769,
      "original_time": "1:19:29",
      "song_id": "LIPEG_BWAXz",
      "comment_source": "comment",
      "comment_date": "2025-05-28T14:19:24Z"
    },
    {
      "time": 5284,
      "original_time": "1:28:04",
      "song_id": "CccQAMIeB0o",
      "comment_source": "comment",
      "comment_date": "2025-05-28T14:19:24Z"
    },
    {
      "time": 5667,
      "original_time": "1:34:27",
      "song_id": "HqrafRtEyrH",
      "comment_source": "comment",
      "comment_date": "2025-05-28T14:19:24Z"
    },
    {
      "time": 6294,
      "original_time": "1:44:54",
      "song_id": "XB0ksgxloiT",
      "comment_source": "comment",
      "comment_date": "2025-05-28T14:19:24Z"
    },
    {
      "time": 7183,
      "original_time": "1:59:43",
      "song_id": "gQ8y507nUUO",
      "comment_source": "comment",
      "comment_date": "2025-05-28T14:19:24Z"
    },
    {
      "time": 8041,
      "original_time": "2:14:01",
      "song_id": "lHRHIAZMfqn",
      "comment_source": "comment",
      "comment_date": "2025-05-28T14:19:24Z"
    }
  ]
}