{
  "video_id": "TYq1Vw60LRc",
  "title": "【#歌枠 】寝る前に一曲いかが？今宵もゆるりと歌っていくよ〜✨【#七篠さよ  】",
  "start_datetime": "2026-01-12T12:17:04Z",
  "thumbnail_url": "https://i.ytimg.com/vi/TYq1Vw60LRc/maxresdefault_live.jpg",
  "timestamps": [
    {
      "time": 535,
      "original_time": "0:08:55",
      "song_id": "n0MeOqrHYNh",
      "comment_source": "comment",
      "comment_date": "2026-01-12T15:26:45Z"
    },
    {
      "time": 1278,
      "original_time": "0:21:18",
      "song_id": "v9N35jyQaZ6",
      "comment_source": "comment",
      "comment_date": "2026-01-12T15:26:45Z"
    },
    {
      "time": 1673,
      "original_time": "0:27:53",
      "song_id": "bUKqJ4nOwyR",
      "comment_source": "comment",
      "comment_date": "2026-01-12T15:26:45Z"
    },
    {
      "time": 2154,
      "original_time": "0:35:54",
      "song_id": "M8bXYcuNIcW",
      "comment_source": "comment",
      "comment_date": "2026-01-12T15:26:45Z"
    },
    {
      "time": 3103,
      "original_time": "0:51:43",
      "song_id": "_34j4YXHokj",
      "comment_source": "comment",
      "comment_date": "2026-01-12T15:26:45Z"
    },
    {
      "time": 3445,
      "original_time": "0:57:25",
      "song_id": "HN5tAn5jnr0",
      "comment_source": "comment",
      "comment_date": "2026-01-12T15:26:45Z"
    },
    {
      "time": 4501,
      "original_time": "1:15:01",
      "song_id": "SRMdrFC_WIp",
      "comment_source": "comment",
      "comment_date": "2026-01-12T15:26:45Z"
    },
    {
      "time": 5332,
      "original_time": "1:28:52",
      "song_id": "_MjdYBKpQLS",
      "comment_source": "comment",
      "comment_date": "2026-01-12T15:26:45Z"
    },
    {
      "time": 6225,
      "original_time": "1:43:45",
      "song_id": "oyMkz_GehvR",
      "comment_source": "comment",
      "comment_date": "2026-01-12T15:26:45Z"
    }
  ]
}