{
  "video_id": "jxotu4dQCIc",
  "title": "【#歌枠 】初見さん大歓迎な元気になれる歌枠＆7/12(日)Vortexライブの紹介✨【 #七篠さよ #vtuber  】",
  "start_datetime": "2026-06-27T15:15:04Z",
  "thumbnail_url": "https://i.ytimg.com/vi/jxotu4dQCIc/maxresdefault.jpg",
  "timestamps": [
    {
      "time": 3027,
      "original_time": "0:50:27",
      "song_id": "TryaeN_O-ez",
      "comment_source": "comment",
      "comment_date": "2026-06-27T15:26:45Z"
    },
    {
      "time": 3385,
      "original_time": "0:56:25",
      "song_id": "R8T3whdwiyV",
      "comment_source": "comment",
      "comment_date": "2026-06-27T15:26:45Z"
    },
    {
      "time": 4050,
      "original_time": "1:07:30",
      "song_id": "n3MjUJa3QuU",
      "comment_source": "comment",
      "comment_date": "2026-06-27T15:26:45Z"
    },
    {
      "time": 4822,
      "original_time": "1:20:22",
      "song_id": "_MjdYBKpQLS",
      "comment_source": "comment",
      "comment_date": "2026-06-27T15:26:45Z"
    },
    {
      "time": 5176,
      "original_time": "1:26:16",
      "song_id": "IYhyIeuR9iM",
      "comment_source": "comment",
      "comment_date": "2026-06-27T15:26:45Z"
    },
    {
      "time": 5747,
      "original_time": "1:35:47",
      "song_id": "poGbYX-fg3e",
      "comment_source": "comment",
      "comment_date": "2026-06-27T15:26:45Z"
    },
    {
      "time": 6172,
      "original_time": "1:42:52",
      "song_id": "o5C0oKZRXeI",
      "comment_source": "comment",
      "comment_date": "2026-06-27T15:26:45Z"
    },
    {
      "time": 6897,
      "original_time": "1:54:57",
      "song_id": "pHg7EFbWeiY",
      "comment_source": "comment",
      "comment_date": "2026-06-27T15:26:45Z"
    },
    {
      "time": 7508,
      "original_time": "2:05:08",
      "song_id": "PRI5kup-pAe",
      "comment_source": "comment",
      "comment_date": "2026-06-27T15:26:45Z"
    },
    {
      "time": 8060,
      "original_time": "2:14:20",
      "song_id": "68jRQD4G9MO",
      "comment_source": "comment",
      "comment_date": "2026-06-27T15:26:45Z"
    },
    {
      "time": 8392,
      "original_time": "2:19:52",
      "song_id": "RDim6m8SzLs",
      "comment_source": "comment",
      "comment_date": "2026-06-27T15:26:45Z"
    },
    {
      "time": 8838,
      "original_time": "2:27:18",
      "song_id": "wV-OSnLTmEV",
      "comment_source": "comment",
      "comment_date": "2026-06-27T15:26:45Z"
    },
    {
      "time": 9649,
      "original_time": "2:40:49",
      "song_id": "Oc0HN15n47a",
      "comment_source": "comment",
      "comment_date": "2026-06-27T15:26:45Z"
    }
  ]
}