{
  "video_id": "m-P0-19v4Mc",
  "title": "【 #歌枠 】トマト爆食い太郎【雲梯マシロ】#エトソラ",
  "start_datetime": "2024-07-23T01:17:26Z",
  "thumbnail_url": "https://i.ytimg.com/vi/m-P0-19v4Mc/maxresdefault.jpg",
  "timestamps": [
    {
      "time": 221,
      "original_time": "00:03:41",
      "song_id": "PC6F4-JkB68",
      "comment_source": "comment",
      "comment_date": "2024-08-05T14:04:29Z"
    },
    {
      "time": 515,
      "original_time": "00:08:35",
      "song_id": "eT27LweSpYV",
      "comment_source": "comment",
      "comment_date": "2024-08-05T14:04:29Z"
    },
    {
      "time": 898,
      "original_time": "00:14:58",
      "song_id": "nNZJd6XBwwL",
      "comment_source": "comment",
      "comment_date": "2024-08-05T14:04:29Z"
    },
    {
      "time": 1405,
      "original_time": "00:23:25",
      "song_id": "F1hxljBDcL0",
      "comment_source": "comment",
      "comment_date": "2024-08-05T14:04:29Z"
    },
    {
      "time": 2224,
      "original_time": "00:37:04",
      "song_id": "eyKl5KNzIoQ",
      "comment_source": "comment",
      "comment_date": "2024-08-05T14:04:29Z"
    },
    {
      "time": 2666,
      "original_time": "00:44:26",
      "song_id": "ndSjKFKzPhq",
      "comment_source": "comment",
      "comment_date": "2024-08-05T14:04:29Z"
    },
    {
      "time": 3322,
      "original_time": "00:55:22",
      "song_id": "nZ7qMJ7XK19",
      "comment_source": "comment",
      "comment_date": "2024-08-05T14:04:29Z"
    }
  ]
}