{
  "video_id": "o0aLTKGPf30",
  "title": "【#歌枠 】リクエストOK✨高評価150にチャレンジ！【＃七篠さよ /＃Vtuber 】＃初見さん歓迎",
  "start_datetime": "2025-03-28T15:30:38Z",
  "thumbnail_url": "https://i.ytimg.com/vi/o0aLTKGPf30/maxresdefault.jpg",
  "timestamps": [
    {
      "time": 559,
      "original_time": "0:09:19",
      "song_id": "rcbdobyhm7u",
      "comment_source": "comment",
      "comment_date": "2025-03-28T15:20:59Z"
    },
    {
      "time": 884,
      "original_time": "0:14:44",
      "song_id": "osShNGh953N",
      "comment_source": "comment",
      "comment_date": "2025-03-28T15:20:59Z"
    },
    {
      "time": 1399,
      "original_time": "0:23:19",
      "song_id": "wYQEAe6lQvt",
      "comment_source": "comment",
      "comment_date": "2025-03-28T15:20:59Z"
    },
    {
      "time": 1677,
      "original_time": "0:27:57",
      "song_id": "UutAGX_LLfv",
      "comment_source": "comment",
      "comment_date": "2025-03-28T15:20:59Z"
    },
    {
      "time": 1976,
      "original_time": "0:32:56",
      "song_id": "F-fB8JpXiRK",
      "comment_source": "comment",
      "comment_date": "2025-03-28T15:20:59Z"
    },
    {
      "time": 2284,
      "original_time": "0:38:04",
      "song_id": "C9rgfjtISu1",
      "comment_source": "comment",
      "comment_date": "2025-03-28T15:20:59Z"
    },
    {
      "time": 2901,
      "original_time": "0:48:21",
      "song_id": "i3Eqt4nYNEn",
      "comment_source": "comment",
      "comment_date": "2025-03-28T15:20:59Z"
    },
    {
      "time": 3281,
      "original_time": "0:54:41",
      "song_id": "xl5tqPN8Flc",
      "comment_source": "comment",
      "comment_date": "2025-03-28T15:20:59Z"
    },
    {
      "time": 3612,
      "original_time": "1:00:12",
      "song_id": "urbMAU4vIwb",
      "comment_source": "comment",
      "comment_date": "2025-03-28T15:20:59Z"
    },
    {
      "time": 3924,
      "original_time": "1:05:24",
      "song_id": "tXsvpLd9FI7",
      "comment_source": "comment",
      "comment_date": "2025-03-28T15:20:59Z"
    },
    {
      "time": 4629,
      "original_time": "1:17:09",
      "song_id": "txEqSJ4DSFN",
      "comment_source": "comment",
      "comment_date": "2025-03-28T15:20:59Z"
    },
    {
      "time": 4960,
      "original_time": "1:22:40",
      "song_id": "WbfZ9NKz4E7",
      "comment_source": "comment",
      "comment_date": "2025-03-28T15:20:59Z"
    },
    {
      "time": 5273,
      "original_time": "1:27:53",
      "song_id": "IYhyIeuR9iM",
      "comment_source": "comment",
      "comment_date": "2025-03-28T15:20:59Z"
    },
    {
      "time": 5622,
      "original_time": "1:33:42",
      "song_id": "qaXfBRgvLGH",
      "comment_source": "comment",
      "comment_date": "2025-03-28T15:20:59Z"
    },
    {
      "time": 7132,
      "original_time": "1:58:52",
      "song_id": "TrEbXxmOKR9",
      "comment_source": "comment",
      "comment_date": "2025-03-28T15:20:59Z"
    },
    {
      "time": 7519,
      "original_time": "2:05:19",
      "song_id": "O-LUx5HHLVZ",
      "comment_source": "comment",
      "comment_date": "2025-03-28T15:20:59Z"
    },
    {
      "time": 8006,
      "original_time": "2:13:26",
      "song_id": "HTpdssOJYVi",
      "comment_source": "comment",
      "comment_date": "2025-03-28T15:20:59Z"
    },
    {
      "time": 8394,
      "original_time": "2:19:54",
      "song_id": "j1bPaH0E6M7",
      "comment_source": "comment",
      "comment_date": "2025-03-28T15:20:59Z"
    },
    {
      "time": 8640,
      "original_time": "2:24:00",
      "song_id": "ECdXDe_4poF",
      "comment_source": "comment",
      "comment_date": "2025-03-28T15:20:59Z"
    },
    {
      "time": 8891,
      "original_time": "2:28:11",
      "song_id": "JqJo7TXRgYt",
      "comment_source": "comment",
      "comment_date": "2025-03-28T15:20:59Z"
    },
    {
      "time": 9180,
      "original_time": "2:33:00",
      "song_id": "Oc0HN15n47a",
      "comment_source": "comment",
      "comment_date": "2025-03-28T15:20:59Z"
    },
    {
      "time": 9438,
      "original_time": "2:37:18",
      "song_id": "YHQ5pJA1cbE",
      "comment_source": "comment",
      "comment_date": "2025-03-28T15:20:59Z"
    },
    {
      "time": 10058,
      "original_time": "2:47:38",
      "song_id": "vQTeRstgvRj",
      "comment_source": "comment",
      "comment_date": "2025-03-28T15:20:59Z"
    }
  ]
}