{
  "video_id": "lEC9bOzqBNI",
  "title": "【#初見さん歓迎】🌹格好良い歌姫とコラボ歌枠✨【 #黒咲ルシア / #七篠さよ】#歌枠 #vtuber",
  "start_datetime": "2024-02-22T19:14:34Z",
  "thumbnail_url": "https://i.ytimg.com/vi/lEC9bOzqBNI/maxresdefault.jpg",
  "timestamps": [
    {
      "time": 629,
      "original_time": "0:10:29",
      "song_id": "dTGHsEm40wj",
      "comment_source": "comment",
      "comment_date": "2024-02-22T14:44:49Z"
    },
    {
      "time": 1906,
      "original_time": "0:31:46",
      "song_id": "9yz1LlwmNF_",
      "comment_source": "comment",
      "comment_date": "2024-02-22T14:44:49Z"
    },
    {
      "time": 2631,
      "original_time": "0:43:51",
      "song_id": "UtNlDJyFzfR",
      "comment_source": "comment",
      "comment_date": "2024-02-22T14:44:49Z"
    },
    {
      "time": 3930,
      "original_time": "1:05:30",
      "song_id": "SlcXFZWQpqe",
      "comment_source": "comment",
      "comment_date": "2024-02-22T14:44:49Z"
    },
    {
      "time": 5840,
      "original_time": "1:37:20",
      "song_id": "z6guqgDlrqM",
      "comment_source": "comment",
      "comment_date": "2024-02-22T14:44:49Z"
    },
    {
      "time": 7396,
      "original_time": "2:03:16",
      "song_id": "MRzARHymsC5",
      "comment_source": "comment",
      "comment_date": "2024-02-22T14:44:49Z"
    },
    {
      "time": 7820,
      "original_time": "2:10:20",
      "song_id": "PxiB2u54Zag",
      "comment_source": "comment",
      "comment_date": "2024-02-22T14:44:49Z"
    },
    {
      "time": 9030,
      "original_time": "2:30:30",
      "song_id": "Al203gDLOY9",
      "comment_source": "comment",
      "comment_date": "2024-02-22T14:44:49Z"
    }
  ]
}