{
  "video_id": "DKV2GzTtWak",
  "title": "ã€#ã‚»ãƒƒã‚·ãƒ§ãƒ³æ­Œæ ãƒªãƒ¬ãƒ¼ ã€‘æ˜¼ä¸‹ãŒã‚Šã«çˆ½ã‚„ã‹ãƒ­ãƒƒã‚¯ãªã‚»ãƒƒã‚·ãƒ§ãƒ³ã‚«ãƒãƒ¼ã‚’ã‚ãªãŸã«ğŸ‹âœ¨ã€#ä¸ƒç¯ ã•ã‚ˆ #é‡ä¸­æµ· ã€‘",
  "start_datetime": "2026-01-18T17:24:51Z",
  "thumbnail_url": "https://i.ytimg.com/vi/DKV2GzTtWak/maxresdefault.jpg",
  "timestamps": [
    {
      "time": 83,
      "original_time": "0:01:23",
      "song_id": "wUChAIo0HI_",
      "comment_source": "comment",
      "comment_date": "2026-01-18T11:58:35Z"
    },
    {
      "time": 457,
      "original_time": "0:07:37",
      "song_id": "fv4VF2nYWXr",
      "comment_source": "comment",
      "comment_date": "2026-01-18T11:58:35Z"
    },
    {
      "time": 883,
      "original_time": "0:14:43",
      "song_id": "oYILKCGdMbK",
      "comment_source": "comment",
      "comment_date": "2026-01-18T11:58:35Z"
    },
    {
      "time": 1047,
      "original_time": "0:17:27",
      "song_id": "qEp4TBybI6m",
      "comment_source": "comment",
      "comment_date": "2026-01-18T11:58:35Z"
    },
    {
      "time": 1562,
      "original_time": "0:26:02",
      "song_id": "i26_6Tzh_9j",
      "comment_source": "comment",
      "comment_date": "2026-01-18T11:58:35Z"
    }
  ]
}