{
  "video_id": "6odmwgKoKrQ",
  "title": "【 #歌枠 】✧ そのうつろいをうたう ✧【エトソラ/Etosora】",
  "start_datetime": "2024-02-15T00:22:23Z",
  "thumbnail_url": "https://i.ytimg.com/vi/6odmwgKoKrQ/maxresdefault.jpg",
  "timestamps": [
    {
      "time": 425,
      "original_time": "00:07:05",
      "song_id": "VSkYIc96vzO",
      "comment_source": "comment",
      "comment_date": "2024-02-16T08:02:38Z"
    },
    {
      "time": 1244,
      "original_time": "00:20:44",
      "song_id": "lLCwh-Ek5LS",
      "comment_source": "comment",
      "comment_date": "2024-02-16T08:02:38Z"
    },
    {
      "time": 2375,
      "original_time": "00:39:35",
      "song_id": "zw9VQTkwUs-",
      "comment_source": "comment",
      "comment_date": "2024-02-16T08:02:38Z"
    },
    {
      "time": 3228,
      "original_time": "00:53:48",
      "song_id": "eT27LweSpYV",
      "comment_source": "comment",
      "comment_date": "2024-02-16T08:02:38Z"
    }
  ]
}
