{
  "video_id": "pxQDMfL6ckc",
  "title": "【 #歌枠 】✧ はじめてのV系しばり ✧【雨飼ミヅキ】#エトソラ",
  "start_datetime": "2025-04-05T01:44:50Z",
  "thumbnail_url": "https://i.ytimg.com/vi/pxQDMfL6ckc/maxresdefault.jpg",
  "timestamps": [
    {
      "time": 110,
      "original_time": "00:01:50",
      "song_id": "MGhU8ns0atg",
      "comment_source": "comment",
      "comment_date": "2025-04-04T13:22:32Z"
    },
    {
      "time": 581,
      "original_time": "00:09:41",
      "song_id": "86otNmBDjrE",
      "comment_source": "comment",
      "comment_date": "2025-04-04T13:22:32Z"
    },
    {
      "time": 1317,
      "original_time": "00:21:57",
      "song_id": "WG6JG0E8So6",
      "comment_source": "comment",
      "comment_date": "2025-04-04T13:22:32Z"
    },
    {
      "time": 2991,
      "original_time": "00:49:51",
      "song_id": "sppEvqNnt-u",
      "comment_source": "comment",
      "comment_date": "2025-04-04T13:22:32Z"
    },
    {
      "time": 3459,
      "original_time": "00:57:39",
      "song_id": "bxNXZPz5zpL",
      "comment_source": "comment",
      "comment_date": "2025-04-04T13:22:32Z"
    }
  ]
}