{
  "video_id": "vfeaIi2kxDo",
  "title": "【 #オレイチ歌枠リレー 】✧ 雨に一番近い場所 ✧【 #雨飼ミヅキfromエトソラ #vtuber 】",
  "start_datetime": "2024-03-23T23:09:04Z",
  "thumbnail_url": "https://i.ytimg.com/vi/vfeaIi2kxDo/maxresdefault.jpg",
  "timestamps": [
    {
      "time": 317,
      "original_time": "00:05:17",
      "song_id": "jvna2lK-_p9",
      "comment_source": "comment",
      "comment_date": "2024-03-23T10:59:49Z"
    },
    {
      "time": 575,
      "original_time": "00:09:35",
      "song_id": "TcAZWqHk-Jk",
      "comment_source": "comment",
      "comment_date": "2024-03-23T10:59:49Z"
    },
    {
      "time": 1052,
      "original_time": "00:17:32",
      "song_id": "dOrv8iJy_6Y",
      "comment_source": "comment",
      "comment_date": "2024-03-23T10:59:49Z"
    },
    {
      "time": 1558,
      "original_time": "00:25:58",
      "song_id": "_-KObNyqJ4V",
      "comment_source": "comment",
      "comment_date": "2024-03-23T10:59:49Z"
    }
  ]
}