{
  "video_id": "MiS8MANvl4I",
  "title": "【 #歌枠 】まだまだ歌い足りないので歌います #vtuber",
  "start_datetime": "2023-12-18T03:40:53Z",
  "thumbnail_url": "https://i.ytimg.com/vi/MiS8MANvl4I/maxresdefault.jpg",
  "timestamps": [
    {
      "time": 147,
      "original_time": "0:02:27",
      "song_id": "Lp9AJ3PZCQo",
      "comment_source": "comment",
      "comment_date": "2023-12-17T14:41:14Z"
    },
    {
      "time": 519,
      "original_time": "0:08:39",
      "song_id": "8b5AiD5rT49",
      "comment_source": "comment",
      "comment_date": "2023-12-17T14:41:14Z"
    },
    {
      "time": 788,
      "original_time": "0:13:08",
      "song_id": "5M6DFhUXInr",
      "comment_source": "comment",
      "comment_date": "2023-12-17T14:41:14Z"
    },
    {
      "time": 1018,
      "original_time": "0:16:58",
      "song_id": "CGrukB5dlWB",
      "comment_source": "comment",
      "comment_date": "2023-12-17T14:41:14Z"
    },
    {
      "time": 1258,
      "original_time": "0:20:58",
      "song_id": "yD5b63zxTuE",
      "comment_source": "comment",
      "comment_date": "2023-12-17T14:41:14Z"
    },
    {
      "time": 1492,
      "original_time": "0:24:52",
      "song_id": "B6poofHY8S_",
      "comment_source": "comment",
      "comment_date": "2023-12-17T14:41:14Z"
    },
    {
      "time": 1989,
      "original_time": "0:33:09",
      "song_id": "t6aA0VO4gIK",
      "comment_source": "comment",
      "comment_date": "2023-12-17T14:41:14Z"
    },
    {
      "time": 2276,
      "original_time": "0:37:56",
      "song_id": "uOFaTkKQEgr",
      "comment_source": "comment",
      "comment_date": "2023-12-17T14:41:14Z"
    },
    {
      "time": 2533,
      "original_time": "0:42:13",
      "song_id": "WRFeKIa47lw",
      "comment_source": "comment",
      "comment_date": "2023-12-17T14:41:14Z"
    },
    {
      "time": 2810,
      "original_time": "0:46:50",
      "song_id": "rsY2kDRjfsl",
      "comment_source": "comment",
      "comment_date": "2023-12-17T14:41:14Z"
    },
    {
      "time": 3383,
      "original_time": "0:56:23",
      "song_id": "TIBQefl6lIs",
      "comment_source": "comment",
      "comment_date": "2023-12-17T14:41:14Z"
    },
    {
      "time": 3595,
      "original_time": "0:59:55",
      "song_id": "_Fpt--CufRB",
      "comment_source": "comment",
      "comment_date": "2023-12-17T14:41:14Z"
    },
    {
      "time": 3793,
      "original_time": "1:03:13",
      "song_id": "P-_wIDlE8So",
      "comment_source": "comment",
      "comment_date": "2023-12-17T14:41:14Z"
    },
    {
      "time": 4016,
      "original_time": "1:06:56",
      "song_id": "7BLGZzkN6ym",
      "comment_source": "comment",
      "comment_date": "2023-12-17T14:41:14Z"
    }
  ]
}